{
  "artifact_grammar_fuzzer": "vouch.artifact-grammar-fuzzer/v0",
  "version": "1.3.11",
  "generator": {
    "script": "scripts/check-artifact-grammar-fuzzer.mjs",
    "seed": "W1.3-artifact-grammar-fuzzer-0001",
    "mode": "deterministic-artifact-grammar-candidate-set",
    "base_artifacts": {
      "native_receipt": "examples/vouch-loop/expected/refund-window.json",
      "bridge_report": "examples/vouch-bridge/reports/checkout-discount.bridge.json",
      "bridge_context_manifest": "examples/vouch-bridge/context/checkout-discount.context.json",
      "verify_report": "generated:lispex verify examples/vouch-loop/expected/refund-window.json",
      "replay_report": "generated:lispex replay profile-gallery/decision-gallery --against profile-gallery/decision-gallery/expected"
    }
  },
  "properties": {
    "required_artifact_classes_present": true,
    "positive_cases_remain_accepted": true,
    "malformed_cases_fail_closed": true,
    "hybrid_cases_rejected_by_all_entrypoints": true
  },
  "summary": {
    "case_count": 26,
    "entrypoint_check_count": 27,
    "positive_accept_count": 5,
    "negative_reject_count": 22,
    "unexpected_accept_count": 0,
    "unexpected_reject_count": 0,
    "missing_expected_failure_count": 0
  },
  "cases": [
    {
      "id": "native-valid",
      "artifact_class": "native-receipt",
      "mutation": "none",
      "coverage": [
        "native-positive"
      ],
      "entrypoints": [
        {
          "name": "native-verify",
          "expected_accept": true,
          "actual_accept": true,
          "exit_code": 0,
          "expected_failure": null,
          "failure_head": []
        }
      ]
    },
    {
      "id": "native-missing-boundary",
      "artifact_class": "native-receipt",
      "mutation": "delete-boundary",
      "coverage": [
        "native-negative",
        "required-field"
      ],
      "entrypoints": [
        {
          "name": "native-verify",
          "expected_accept": false,
          "actual_accept": false,
          "exit_code": 1,
          "expected_failure": "missing-boundary",
          "failure_head": [
            "missing-boundary",
            "boundary-attests-mismatch",
            "boundary-excludes-mismatch"
          ]
        }
      ]
    },
    {
      "id": "native-unknown-top-level",
      "artifact_class": "native-receipt",
      "mutation": "insert-self-hash-top-level",
      "coverage": [
        "native-negative",
        "unknown-top-level"
      ],
      "entrypoints": [
        {
          "name": "native-verify",
          "expected_accept": false,
          "actual_accept": false,
          "exit_code": 1,
          "expected_failure": "unknown-top-level-field:self_hash",
          "failure_head": [
            "unknown-top-level-field:self_hash"
          ]
        }
      ]
    },
    {
      "id": "native-wrong-tag",
      "artifact_class": "native-receipt",
      "mutation": "wrong-tag",
      "coverage": [
        "native-negative",
        "tag"
      ],
      "entrypoints": [
        {
          "name": "native-verify",
          "expected_accept": false,
          "actual_accept": false,
          "exit_code": 1,
          "expected_failure": "tag-mismatch",
          "failure_head": [
            "tag-mismatch"
          ]
        }
      ]
    },
    {
      "id": "hybrid-native-plus-bridge-fields",
      "artifact_class": "malformed-hybrid",
      "mutation": "native-with-bridge-only-fields",
      "coverage": [
        "hybrid-negative",
        "cross-class-smuggling"
      ],
      "entrypoints": [
        {
          "name": "native-verify",
          "expected_accept": false,
          "actual_accept": false,
          "exit_code": 1,
          "expected_failure": "unknown-top-level-field:bridge_report",
          "failure_head": [
            "unknown-top-level-field:bridge_report",
            "unknown-top-level-field:checks",
            "unknown-top-level-field:linked_artifacts",
            "unknown-top-level-field:profile",
            "unknown-top-level-field:subject",
            "unknown-top-level-field:summary"
          ]
        },
        {
          "name": "bridge-verify",
          "expected_accept": false,
          "actual_accept": false,
          "exit_code": 1,
          "expected_failure": "non-canonical-artifact-json",
          "failure_head": [
            "non-canonical-artifact-json"
          ]
        }
      ]
    },
    {
      "id": "bridge-valid",
      "artifact_class": "bridge-report",
      "mutation": "none",
      "coverage": [
        "bridge-positive"
      ],
      "entrypoints": [
        {
          "name": "bridge-verify",
          "expected_accept": true,
          "actual_accept": true,
          "exit_code": 0,
          "expected_failure": null,
          "failure_head": []
        }
      ]
    },
    {
      "id": "bridge-compact-json",
      "artifact_class": "bridge-report",
      "mutation": "compact-json-bytes",
      "coverage": [
        "bridge-negative",
        "canonical-byte-acceptance"
      ],
      "entrypoints": [
        {
          "name": "bridge-verify",
          "expected_accept": false,
          "actual_accept": false,
          "exit_code": 1,
          "expected_failure": "non-canonical-artifact-json",
          "failure_head": [
            "non-canonical-artifact-json"
          ]
        }
      ]
    },
    {
      "id": "bridge-crlf-json",
      "artifact_class": "bridge-report",
      "mutation": "crlf-json-bytes",
      "coverage": [
        "bridge-negative",
        "canonical-byte-acceptance"
      ],
      "entrypoints": [
        {
          "name": "bridge-verify",
          "expected_accept": false,
          "actual_accept": false,
          "exit_code": 1,
          "expected_failure": "non-canonical-artifact-json",
          "failure_head": [
            "non-canonical-artifact-json"
          ]
        }
      ]
    },
    {
      "id": "bridge-missing-boundary",
      "artifact_class": "bridge-report",
      "mutation": "delete-boundary",
      "coverage": [
        "bridge-negative",
        "required-field"
      ],
      "entrypoints": [
        {
          "name": "bridge-verify",
          "expected_accept": false,
          "actual_accept": false,
          "exit_code": 1,
          "expected_failure": "missing-boundary",
          "failure_head": [
            "missing-boundary",
            "boundary-attests-mismatch",
            "boundary-excludes-mismatch"
          ]
        }
      ]
    },
    {
      "id": "bridge-engine-extra",
      "artifact_class": "bridge-report",
      "mutation": "insert-engine-extra",
      "coverage": [
        "bridge-negative",
        "recursive-closed-world"
      ],
      "entrypoints": [
        {
          "name": "bridge-verify",
          "expected_accept": false,
          "actual_accept": false,
          "exit_code": 1,
          "expected_failure": "unknown-field:engine.extra",
          "failure_head": [
            "unknown-field:engine.extra"
          ]
        }
      ]
    },
    {
      "id": "bridge-trust-field-smuggling",
      "artifact_class": "bridge-report",
      "mutation": "insert-subject-route-semantic-proof",
      "coverage": [
        "bridge-negative",
        "trust-field-smuggling"
      ],
      "entrypoints": [
        {
          "name": "bridge-verify",
          "expected_accept": false,
          "actual_accept": false,
          "exit_code": 1,
          "expected_failure": "unknown-field:subject.route.semantic_proof",
          "failure_head": [
            "unknown-field:subject.route.semantic_proof"
          ]
        }
      ]
    },
    {
      "id": "bridge-source-hash-domain-substitution",
      "artifact_class": "bridge-report",
      "mutation": "source-hash-domain-substitution",
      "coverage": [
        "bridge-negative",
        "hash-domain"
      ],
      "entrypoints": [
        {
          "name": "bridge-verify",
          "expected_accept": false,
          "actual_accept": false,
          "exit_code": 1,
          "expected_failure": "source-hash-domain",
          "failure_head": [
            "source-hash-domain"
          ]
        }
      ]
    },
    {
      "id": "bridge-optional-null-smuggling",
      "artifact_class": "bridge-report",
      "mutation": "engine-commit-null",
      "coverage": [
        "bridge-negative",
        "optional-null-smuggling"
      ],
      "entrypoints": [
        {
          "name": "bridge-verify",
          "expected_accept": false,
          "actual_accept": false,
          "exit_code": 1,
          "expected_failure": "engine-commit-missing",
          "failure_head": [
            "engine-commit-missing"
          ]
        }
      ]
    },
    {
      "id": "context-valid",
      "artifact_class": "context-manifest",
      "mutation": "none",
      "coverage": [
        "context-positive"
      ],
      "entrypoints": [
        {
          "name": "bridge-verify-with-context",
          "expected_accept": true,
          "actual_accept": true,
          "exit_code": 0,
          "expected_failure": null,
          "failure_head": []
        }
      ]
    },
    {
      "id": "context-wrong-tag",
      "artifact_class": "context-manifest",
      "mutation": "wrong-context-tag",
      "coverage": [
        "context-negative",
        "tag"
      ],
      "entrypoints": [
        {
          "name": "bridge-verify-with-context",
          "expected_accept": false,
          "actual_accept": false,
          "exit_code": 1,
          "expected_failure": "context-manifest-tag-mismatch",
          "failure_head": [
            "context-manifest-tag-mismatch"
          ]
        }
      ]
    },
    {
      "id": "context-wrong-route",
      "artifact_class": "context-manifest",
      "mutation": "route-id-mismatch",
      "coverage": [
        "context-negative",
        "intent-binding"
      ],
      "entrypoints": [
        {